id,title,score,num_comments,author,created_utc,url,over_18,edited,spoiler,stickied,upvote_ratio
1n8ggw3,people questioning your results?,39,37,EdgeCautious7312,2025-09-04 17:25:55,https://www.reddit.com/r/dataengineering/comments/1n8ggw3/people_questioning_your_results/,False,False,False,False,0
1n8rb9q,"Which DB engine for personnel data - 250k records, arbitrary elements, performance little concern",30,61,FarhanYusufzai,2025-09-05 00:45:54,https://www.reddit.com/r/dataengineering/comments/1n8rb9q/which_db_engine_for_personnel_data_250k_records/,False,False,False,False,0
1n912uv,For those who switched from Airflow (or similar) to Dagster – what’s been your experience,28,9,No-Conversation476,2025-09-05 09:59:37,https://www.reddit.com/r/dataengineering/comments/1n912uv/for_those_who_switched_from_airflow_or_similar_to/,False,False,False,False,0
1n8g9il,What should a third year DE look like,18,1,yabadabawhat,2025-09-04 17:18:01,https://www.reddit.com/r/dataengineering/comments/1n8g9il/what_should_a_third_year_de_look_like/,False,False,False,False,0
1n93ghc,You don’t get fired for choosing Spark/Flink,18,36,itamarwe,2025-09-05 12:07:04,https://www.reddit.com/r/dataengineering/comments/1n93ghc/you_dont_get_fired_for_choosing_sparkflink/,False,False,False,False,0
1n8gfgb,Share an interesting side project you’ve been working on.,17,21,KeyPossibility2339,2025-09-04 17:24:21,https://www.reddit.com/r/dataengineering/comments/1n8gfgb/share_an_interesting_side_project_youve_been/,False,False,False,False,1
1n932y6,Extending the One Trillion Row Challenge to Iceberg tables,8,2,bitter-cognac,2025-09-05 11:48:50,https://www.reddit.com/r/dataengineering/comments/1n932y6/extending_the_one_trillion_row_challenge_to/,False,False,False,False,0
1n8n2y7,Change data type in delta table,7,2,oakepilef,2025-09-04 21:41:01,https://www.reddit.com/r/dataengineering/comments/1n8n2y7/change_data_type_in_delta_table/,False,False,False,False,0
1n8zzcl,Anyone transitioned from Data engineer to system design engineer or data scientist?,8,3,Humble_Jacket_6347,2025-09-05 08:50:02,https://www.reddit.com/r/dataengineering/comments/1n8zzcl/anyone_transitioned_from_data_engineer_to_system/,False,False,False,False,0
1n8ulad,Migrating from Teradata to Azure Databricks -- How to implement steps,6,0,Returnforgood,2025-09-05 03:24:49,https://www.reddit.com/r/dataengineering/comments/1n8ulad/migrating_from_teradata_to_azure_databricks_how/,False,False,False,False,1
1n8zh6a,"I am a data engineer on paper but there are no projects atm, I am being told to upksill and contribute in ERPNext integration",5,7,Potential_Loss6978,2025-09-05 08:16:29,https://www.reddit.com/r/dataengineering/comments/1n8zh6a/i_am_a_data_engineer_on_paper_but_there_are_no/,False,False,False,False,0
1n945se,What is the hourly rate for a Data Engineering Contractor with 9+ YOE?,3,7,Infamous_Respond4903,2025-09-05 12:39:22,https://www.reddit.com/r/dataengineering/comments/1n945se/what_is_the_hourly_rate_for_a_data_engineering/,False,False,False,False,0
1n8nmrg,SQL databases closest or most adaptable to Amazon Redshift?,4,3,MullingMulianto,2025-09-04 22:03:29,https://www.reddit.com/r/dataengineering/comments/1n8nmrg/sql_databases_closest_or_most_adaptable_to_amazon/,False,False,False,False,0
1n8ikbn,Confused about designing schema for 3rd-party + SaaS data,4,3,Careful_Treacle3427,2025-09-04 18:45:38,https://www.reddit.com/r/dataengineering/comments/1n8ikbn/confused_about_designing_schema_for_3rdparty_saas/,False,False,False,False,1
1n8dd9w,NYC Data Engineering event,4,2,Best_Note_8055,2025-09-04 15:30:19,https://www.reddit.com/r/dataengineering/comments/1n8dd9w/nyc_data_engineering_event/,False,False,False,False,1
1n8i8bu,Storage Event Trigger in ADF match multiple patterns,3,1,Fearless-Amount2020,2025-09-04 18:32:59,https://www.reddit.com/r/dataengineering/comments/1n8i8bu/storage_event_trigger_in_adf_match_multiple/,False,False,False,False,1
1n91j5x,Data integrity,2,2,Apprehensive-Menu803,2025-09-05 10:26:12,https://www.reddit.com/r/dataengineering/comments/1n91j5x/data_integrity/,False,False,False,False,0
1n91zy9,Spark resource configuration,1,1,arunrajan96,2025-09-05 10:52:34,https://www.reddit.com/r/dataengineering/comments/1n91zy9/spark_resource_configuration/,False,False,False,False,0
1n96yox,DVD-Rental Data Pipeline Project Component,2,2,Total_Weakness5485,2025-09-05 14:35:15,https://www.reddit.com/r/dataengineering/comments/1n96yox/dvdrental_data_pipeline_project_component/,False,False,False,False,0
1n96q8d,Wiring your ETL/live tables into LLMs via MCP,1,0,Typical-Scene-5794,2025-09-05 14:26:12,https://www.reddit.com/r/dataengineering/comments/1n96q8d/wiring_your_etllive_tables_into_llms_via_mcp/,False,False,False,False,0
1n9581t,Azure Data Factory question: Best way to trigger a pipeline after another pipeline finishes without the parent pipeline having any reference to the child,0,10,PaulSandwich,2025-09-05 13:25:30,https://www.reddit.com/r/dataengineering/comments/1n9581t/azure_data_factory_question_best_way_to_trigger_a/,False,False,False,False,0
1n94u8j,Data Modeling Guide for Real-Time Analytics with ClickHouse,0,1,sspaeti,2025-09-05 13:09:07,https://www.ssp.sh/blog/practical-data-modeling-clickhouse/,False,False,False,False,0
